,source,native,name,p_value,significant,description,term_size,query_size,intersection_size,effective_domain_size,precision,recall,query,parents
972,GO:CC,GO:0031093,platelet alpha granule lumen,0.00014677262647050574,True,"""The volume enclosed by the membrane of the platelet alpha granule."" [GOC:mah, PMID:8467233]",66,1541,18,22097,0.011680726800778715,0.2727272727272727,Module Singleton,"['GO:0031091', 'GO:0034774']"
973,HPA,HPA:0031293,appendix; endocrine cells[High],0.00014732860169870368,True,appendix; endocrine cells[High],231,922,43,11019,0.046637744034707156,0.18614718614718614,Module Singleton,['HPA:0031292']
974,GO:BP,GO:0050832,defense response to fungus,0.00015153216539241204,True,"""Reactions triggered in response to the presence of a fungus that act to protect the cell or organism."" [GOC:ai]",59,1478,18,21031,0.012178619756427604,0.3050847457627119,Module Singleton,"['GO:0009620', 'GO:0098542']"
975,WP,WP:WP2865,IL1 and megakaryocytes in obesity,0.00015244731314842166,True,IL1 and megakaryocytes in obesity,24,813,12,8286,0.014760147601476014,0.5,Module Singleton,['WP:000000']
976,GO:BP,GO:0050896,response to stimulus,0.00015367511609162227,True,"""Any process that results in a change in state or activity of a cell or an organism (in terms of movement, secretion, enzyme production, gene expression, etc.) as a result of a stimulus. The process begins with detection of the stimulus and ends with a change in state or activity or the cell or organism."" [GOC:ai, GOC:bf]",8976,23,22,21031,0.9565217391304348,0.0024509803921568627,Module 4,['GO:0008150']
977,GO:BP,GO:0006996,organelle organization,0.00015429655294619407,True,"""A process that is carried out at the cellular level which results in the assembly, arrangement of constituent parts, or disassembly of an organelle within a cell. An organelle is an organized structure of distinctive morphology and function. Includes the nucleus, mitochondria, plastids, vacuoles, vesicles, ribosomes and the cytoskeleton. Excludes the plasma membrane."" [GOC:mah]",3613,59,28,21031,0.4745762711864407,0.0077497924162745644,Module 0,['GO:0016043']
978,HPA,HPA:0641472,endometrium; lymphocytes[≥Medium],0.00015618307809855462,True,endometrium; lymphocytes[≥Medium],24,34,4,11019,0.11764705882352941,0.16666666666666666,Module 2,['HPA:0641471']
979,GO:MF,GO:0003756,protein disulfide isomerase activity,0.0001562618705215445,True,"""Catalysis of the rearrangement of both intrachain and interchain disulfide bonds in proteins."" [EC:5.3.4.1, GOC:vw, Wikipedia:Protein_disulfide-isomerase#Function]",19,61,4,20212,0.06557377049180328,0.21052631578947367,Module 1,"['GO:0016864', 'GO:0140096']"
980,GO:MF,GO:0016864,"intramolecular oxidoreductase activity, transposing S-S bonds",0.0001562618705215445,True,"""Catalysis of an oxidation-reduction (redox) reaction in which the hydrogen donor and acceptor are the same molecule, one or more sulfur-sulfur bonds in the molecule are rearranged, and no oxidized product appears."" [EC:5.3.4.-, GOC:mah]",19,61,4,20212,0.06557377049180328,0.21052631578947367,Module 1,['GO:0016860']
981,GO:BP,GO:0042269,regulation of natural killer cell mediated cytotoxicity,0.00015925674665899118,True,"""Any process that modulates the frequency, rate, or extent of natural killer cell mediated cytotoxicity."" [GOC:add, ISBN:0781735149]",45,52,5,21031,0.09615384615384616,0.1111111111111111,Module 2,"['GO:0001910', 'GO:0002715', 'GO:0042267']"
982,GO:BP,GO:0002819,regulation of adaptive immune response,0.00016133117095654495,True,"""Any process that modulates the frequency, rate, or extent of an adaptive immune response."" [GOC:add]",202,1478,37,21031,0.02503382949932341,0.18316831683168316,Module Singleton,"['GO:0002250', 'GO:0050776']"
983,HPA,HPA:0600443,tonsil; non-germinal center cells[High],0.00016236936561745666,True,tonsil; non-germinal center cells[High],1321,18,11,11019,0.6111111111111112,0.008327024981074944,Module 4,['HPA:0600442']
984,HP,HP:0001743,Abnormality of the spleen,0.0001673555714488608,True,An abnormality of the spleen.,619,400,86,4958,0.215,0.13893376413570274,Module Singleton,"['HP:0002012', 'HP:0100763']"
985,GO:BP,GO:0042127,regulation of cell population proliferation,0.0001701267857730225,True,"""Any process that modulates the frequency, rate or extent of cell proliferation."" [GOC:jl]",1683,59,19,21031,0.3220338983050847,0.0112893642305407,Module 0,"['GO:0008283', 'GO:0050794']"
986,GO:MF,GO:0032394,MHC class Ib receptor activity,0.00017070732300339742,True,"""Combining with an MHC class Ib protein complex and transmitting the signal from one side of the membrane to the other to initiate a change in cell activity. Class Ib here refers to non-classical class I molecules, such as those of the CD1 or HLA-E gene families."" [GOC:add, GOC:signaling, ISBN:0781735149]",6,54,3,20212,0.05555555555555555,0.5,Module 2,"['GO:0004888', 'GO:0140375']"
987,GO:MF,GO:0031726,CCR1 chemokine receptor binding,0.00017070732300339742,True,"""Binding to a CCR1 chemokine receptor."" [GOC:mah, GOC:nln]",6,54,3,20212,0.05555555555555555,0.5,Module 2,['GO:0048020']
988,GO:BP,GO:0048519,negative regulation of biological process,0.0001711869406799371,True,"""Any process that stops, prevents, or reduces the frequency, rate or extent of a biological process. Biological processes are regulated by many means; examples include the control of gene expression, protein modification or interaction with a protein or substrate molecule."" [GOC:jid]",5874,37,26,21031,0.7027027027027027,0.004426285325161729,Module 3,"['GO:0008150', 'GO:0050789']"
989,GO:CC,GO:0005768,endosome,0.0001714773909127287,True,"""A vacuole to which materials ingested by endocytosis are delivered."" [ISBN:0198506732, PMID:19696797]",1060,24,9,22097,0.375,0.008490566037735849,Module 4,"['GO:0012505', 'GO:0031410']"
990,GO:BP,GO:0050727,regulation of inflammatory response,0.00017345416098364668,True,"""Any process that modulates the frequency, rate or extent of the inflammatory response, the immediate defensive reaction (by vertebrate tissue) to infection or injury caused by chemical or physical agents."" [GOC:ai]",375,59,10,21031,0.1694915254237288,0.02666666666666667,Module 0,"['GO:0006954', 'GO:0031347', 'GO:0032101']"
991,GO:BP,GO:0032970,regulation of actin filament-based process,0.00017781232417348277,True,"""Any process that modulates the frequency, rate or extent of any cellular process that depends upon or alters the actin cytoskeleton."" [GOC:mah]",376,59,10,21031,0.1694915254237288,0.026595744680851064,Module 0,"['GO:0030029', 'GO:0050794']"
992,GO:BP,GO:0014002,astrocyte development,0.00018014699836483837,True,"""The process aimed at the progression of an astrocyte over time, from initial commitment of the cell to a specific fate, to the fully functional differentiated cell. An astrocyte is the most abundant type of glial cell. Astrocytes provide support for neurons and regulate the environment in which they function."" [GOC:dgh, GOC:ef]",42,1478,15,21031,0.010148849797023005,0.35714285714285715,Module Singleton,"['GO:0021782', 'GO:0048708']"
993,HPA,HPA:0401292,rectum; endocrine cells[≥Medium],0.000185985533751562,True,rectum; endocrine cells[≥Medium],408,922,64,11019,0.06941431670281996,0.1568627450980392,Module Singleton,['HPA:0401291']
994,HPA,HPA:0461443,skin 1; fibrohistiocytic cells[High],0.000185985533751562,True,skin 1; fibrohistiocytic cells[High],408,922,64,11019,0.06941431670281996,0.1568627450980392,Module Singleton,['HPA:0461442']
995,GO:BP,GO:0043086,negative regulation of catalytic activity,0.00018988927280705247,True,"""Any process that stops or reduces the activity of an enzyme."" [GOC:ebc, GOC:jl, GOC:tb, GOC:vw]",396,1478,58,21031,0.03924221921515562,0.14646464646464646,Module Singleton,"['GO:0044092', 'GO:0050790']"
996,GO:BP,GO:0031640,killing of cells of another organism,0.00019048156357527412,True,"""Any process in an organism that results in the killing of cells of another organism, including in some cases the death of the other organism. Killing here refers to the induction of death in one cell by another cell, not cell-autonomous death due to internal or other environmental conditions."" [GOC:add]",92,52,6,21031,0.11538461538461539,0.06521739130434782,Module 2,"['GO:0001906', 'GO:0141061']"
997,GO:BP,GO:0141061,disruption of cell in another organism,0.00019048156357527412,True,"""The disruption of a cell of another organism, leading to damage or temporary subversion of that cell."" [GOC:pg]",92,52,6,21031,0.11538461538461539,0.06521739130434782,Module 2,['GO:0141060']
998,HPA,HPA:0460181,skin 1; cells in granular layer[≥Low],0.00019171291525366265,True,skin 1; cells in granular layer[≥Low],711,47,14,11019,0.2978723404255319,0.01969057665260197,Module 1,['HPA:0460000']
999,HPA,HPA:0151302,duodenum; enterocytes[≥Medium],0.00019483829586834262,True,duodenum; enterocytes[≥Medium],426,922,66,11019,0.07158351409978309,0.15492957746478872,Module Singleton,['HPA:0151301']
1000,HPA,HPA:0461471,skin 1; lymphocytes[≥Low],0.0001949826738319218,True,skin 1; lymphocytes[≥Low],712,47,14,11019,0.2978723404255319,0.019662921348314606,Module 1,['HPA:0460000']
1001,HPA,HPA:0310431,lymph node; germinal center cells[≥Low],0.0001979224589709175,True,lymph node; germinal center cells[≥Low],5061,47,38,11019,0.8085106382978723,0.007508397549891326,Module 1,['HPA:0310000']
1002,GO:MF,GO:0008092,cytoskeletal protein binding,0.00019835621683307145,True,"""Binding to a protein component of a cytoskeleton (actin, microtubule, or intermediate filament cytoskeleton)."" [GOC:mah]",1002,64,15,20212,0.234375,0.014970059880239521,Module 0,['GO:0005515']
1003,HPA,HPA:0461482,skin 1; sebaceous glands[≥Medium],0.00019928477806981798,True,skin 1; sebaceous glands[≥Medium],165,52,8,11019,0.15384615384615385,0.048484848484848485,Module 0,['HPA:0461481']
1004,REAC,REAC:R-HSA-5663220,RHO GTPases Activate Formins,0.00020074068639418054,True,RHO GTPases Activate Formins,136,982,32,10842,0.032586558044806514,0.23529411764705882,Module Singleton,['REAC:R-HSA-195258']
1005,GO:CC,GO:0031261,DNA replication preinitiation complex,0.00020123210906441708,True,"""A protein-DNA complex assembled at eukaryotic DNA replication origins immediately prior to the initiation of DNA replication. The preinitiation complex is formed by the assembly of additional proteins onto an existing prereplicative complex. In budding yeast, the additional proteins might include Cdc45p, Sld2p, Sld3p, Dpb11p, DNA polymerases, and others; in fission yeast the GINS complex is present."" [GOC:bf, GOC:hjd, GOC:jl, GOC:pr, GOC:rb, GOC:vw, PMID:12694535, PMID:15194812, PMID:17230184]",13,1541,8,22097,0.005191434133679429,0.6153846153846154,Module Singleton,"['GO:0005654', 'GO:0032993', 'GO:0140513']"
1006,GO:BP,GO:0097190,apoptotic signaling pathway,0.00020261564979720125,True,"""The series of molecular signals which triggers the apoptotic death of a cell. The pathway starts with reception of a signal, and ends when the execution phase of apoptosis is triggered."" [GOC:mtg_apoptosis]",607,59,12,21031,0.2033898305084746,0.019769357495881382,Module 0,"['GO:0006915', 'GO:0007165']"
1007,GO:BP,GO:0043300,regulation of leukocyte degranulation,0.00020330577830831816,True,"""Any process that modulates the frequency, rate, or extent of leukocyte degranulation."" [GOC:add, ISBN:0781735149]",48,1478,16,21031,0.010825439783491205,0.3333333333333333,Module Singleton,"['GO:0002697', 'GO:0043299', 'GO:1903305']"
1008,GO:BP,GO:0009967,positive regulation of signal transduction,0.00020391310141571102,True,"""Any process that activates or increases the frequency, rate or extent of signal transduction."" [GOC:sm]",1561,1478,164,21031,0.11096075778078485,0.10506085842408712,Module Singleton,"['GO:0007165', 'GO:0009966', 'GO:0010647', 'GO:0023056', 'GO:0048584']"
1009,GO:BP,GO:0009605,response to external stimulus,0.00020631823325899059,True,"""Any process that results in a change in state or activity of a cell or an organism (in terms of movement, secretion, enzyme production, gene expression, etc.) as a result of an external stimulus."" [GOC:hb]",2723,59,24,21031,0.4067796610169492,0.008813808299669483,Module 0,['GO:0050896']
1010,GO:BP,GO:0002822,regulation of adaptive immune response based on somatic recombination of immune receptors built from immunoglobulin superfamily domains,0.0002083372396364343,True,"""Any process that modulates the frequency, rate, or extent of an adaptive immune response based on somatic recombination of immune receptors built from immunoglobulin superfamily domains. An example of this process is found in the Gnathostomata."" [GOC:add, GOC:mtg_sensu]",187,1478,35,21031,0.02368064952638701,0.18716577540106952,Module Singleton,"['GO:0002460', 'GO:0002819']"
1011,HPA,HPA:0151293,duodenum; endocrine cells[High],0.00020890028220756147,True,duodenum; endocrine cells[High],307,922,52,11019,0.05639913232104121,0.16938110749185667,Module Singleton,['HPA:0151292']
1012,GO:BP,GO:0042327,positive regulation of phosphorylation,0.0002098973631894017,True,"""Any process that activates or increases the frequency, rate or extent of addition of phosphate groups to a molecule."" [GOC:jl]",630,1478,81,21031,0.05480378890392422,0.12857142857142856,Module Singleton,"['GO:0016310', 'GO:0042325', 'GO:0045937']"
1013,GO:BP,GO:0002446,neutrophil mediated immunity,0.000210732687568508,True,"""Any process involved in the carrying out of an immune response by a neutrophil."" [GO_REF:0000022, GOC:add, ISBN:0781735149]",37,1478,14,21031,0.009472259810554804,0.3783783783783784,Module Singleton,['GO:0002444']
1014,GO:BP,GO:0048245,eosinophil chemotaxis,0.0002129464353687605,True,"""The movement of an eosinophil in response to an external stimulus."" [GOC:jid, PMID:11292027, PMID:12391252]",27,1478,12,21031,0.008119079837618403,0.4444444444444444,Module Singleton,"['GO:0071621', 'GO:0072677']"
1015,GO:BP,GO:0071674,mononuclear cell migration,0.00021445214694959275,True,"""The movement of a mononuclear cell within or between different tissues and organs of the body."" [GOC:mah]",205,59,8,21031,0.13559322033898305,0.03902439024390244,Module 0,['GO:0050900']
1016,GO:BP,GO:0048872,homeostasis of number of cells,0.0002149973232823373,True,"""Any biological process involved in the maintenance of the steady-state number of cells within a population of cells."" [GOC:isa_complete]",321,1478,50,21031,0.03382949932341001,0.1557632398753894,Module Singleton,['GO:0048871']
1017,GO:BP,GO:0002274,myeloid leukocyte activation,0.00021697292159303117,True,"""A change in the morphology or behavior of a myeloid leukocyte resulting from exposure to an activating factor such as a cellular or soluble ligand."" [GOC:add, ISBN:0781735149]",238,52,8,21031,0.15384615384615385,0.03361344537815126,Module 2,['GO:0045321']
1018,GO:CC,GO:0098687,chromosomal region,0.0002186332691466214,True,"""Any subdivision of a chromosome along its length."" [GOC:dos]",402,1541,56,22097,0.036340038935756006,0.13930348258706468,Module Singleton,"['GO:0005694', 'GO:0110165']"
1019,HPA,HPA:0470181,skin 2; cells in granular layer[≥Low],0.00021931376115042872,True,skin 2; cells in granular layer[≥Low],719,47,14,11019,0.2978723404255319,0.019471488178025034,Module 1,['HPA:0470000']
1020,WP,WP:WP5088,Prostaglandin signaling,0.00022137469078193357,True,Prostaglandin signaling,33,813,14,8286,0.017220172201722016,0.42424242424242425,Module Singleton,['WP:000000']
1021,HPA,HPA:0401291,rectum; endocrine cells[≥Low],0.00022220283424625873,True,rectum; endocrine cells[≥Low],454,922,69,11019,0.07483731019522777,0.15198237885462554,Module Singleton,['HPA:0400000']
1022,REAC,REAC:R-HSA-76005,Response to elevated platelet cytosolic Ca2+,0.0002228227916674587,True,Response to elevated platelet cytosolic Ca2+,130,982,31,10842,0.031568228105906315,0.23846153846153847,Module Singleton,['REAC:R-HSA-76002']
1023,REAC,REAC:R-HSA-3299685,Detoxification of Reactive Oxygen Species,0.00022475322687705323,True,Detoxification of Reactive Oxygen Species,35,52,5,10842,0.09615384615384616,0.14285714285714285,Module 1,['REAC:R-HSA-9711123']
1024,GO:BP,GO:0002719,negative regulation of cytokine production involved in immune response,0.0002261041867252608,True,"""Any process that stops, prevents, or reduces the frequency, rate, or extent of cytokine production contributing to an immune response."" [GOC:add]",32,1478,13,21031,0.008795669824086604,0.40625,Module Singleton,"['GO:0001818', 'GO:0002367', 'GO:0002701', 'GO:0002718']"
1025,REAC,REAC:R-HSA-1236975,Antigen processing-Cross presentation,0.0002262635311493528,True,Antigen processing-Cross presentation,105,52,7,10842,0.1346153846153846,0.06666666666666667,Module 1,['REAC:R-HSA-983169']
1026,GO:BP,GO:0051246,regulation of protein metabolic process,0.00022756495287202941,True,"""Any process that modulates the frequency, rate or extent of the chemical reactions and pathways involving a protein."" [GOC:ai]",2102,59,21,21031,0.3559322033898305,0.009990485252140819,Module 0,"['GO:0019538', 'GO:0051171', 'GO:0060255', 'GO:0080090']"
1027,WP,WP:WP2849,Hematopoietic stem cell differentiation,0.00022853427529239656,True,Hematopoietic stem cell differentiation,57,813,19,8286,0.023370233702337023,0.3333333333333333,Module Singleton,['WP:000000']
1028,GO:MF,GO:0019899,enzyme binding,0.00022948784629228515,True,"""Binding to an enzyme, a protein with catalytic activity."" [GOC:jl]",2103,61,21,20212,0.3442622950819672,0.009985734664764621,Module 1,['GO:0005515']
1029,GO:BP,GO:1902533,positive regulation of intracellular signal transduction,0.000229650511592749,True,"""Any process that activates or increases the frequency, rate or extent of intracellular signal transduction."" [GOC:BHF, GOC:dph, GOC:signaling, GOC:tb, GOC:TermGenie]",1033,59,15,21031,0.2542372881355932,0.01452081316553727,Module 0,"['GO:0009967', 'GO:0035556', 'GO:1902531']"
1030,GO:BP,GO:0141060,disruption of anatomical structure in another organism,0.0002308604078424922,True,"""The disruption of an anatomical structure of another organism, leading to damage or temporary subversion of that structure."" [GOC:pg]",95,52,6,21031,0.11538461538461539,0.06315789473684211,Module 2,['GO:0044419']
1031,REAC,REAC:R-HSA-68877,Mitotic Prometaphase,0.00023200285577798817,True,Mitotic Prometaphase,199,982,41,10842,0.04175152749490835,0.20603015075376885,Module Singleton,['REAC:R-HSA-68886']
1032,GO:BP,GO:1903035,negative regulation of response to wounding,0.00023326475545101027,True,"""Any process that stops, prevents or reduces the frequency, rate or extent of response to wounding."" [GO_REF:0000058, GOC:kmv, GOC:TermGenie, PMID:19164535]",94,1478,23,21031,0.015561569688768605,0.24468085106382978,Module Singleton,"['GO:0009611', 'GO:0048585', 'GO:1903034']"
1033,GO:MF,GO:0003785,actin monomer binding,0.00023441549742407719,True,"""Binding to monomeric actin, also known as G-actin."" [GOC:ai]",29,14,3,20212,0.21428571428571427,0.10344827586206896,Module 5,['GO:0003779']
1034,GO:BP,GO:0002532,production of molecular mediator involved in inflammatory response,0.00023474040758084884,True,"""The synthesis or release of any molecular mediator of the inflammatory response following an inflammatory stimulus, resulting in an increase in its intracellular or extracellular levels."" [GOC:add, GOC:dph, GOC:tb, ISBN:0781735149]",87,1478,22,21031,0.014884979702300407,0.25287356321839083,Module Singleton,"['GO:0006954', 'GO:0032501']"
1035,HPA,HPA:0530721,spleen; cells in white pulp[≥Low],0.00023575581237449283,True,spleen; cells in white pulp[≥Low],4339,18,17,11019,0.9444444444444444,0.003917953445494353,Module 4,['HPA:0530000']
1036,GO:BP,GO:0006950,response to stress,0.00023634241158068122,True,"""Any process that results in a change in state or activity of a cell or an organism (in terms of movement, secretion, enzyme production, gene expression, etc.) as a result of a disturbance in organismal or cellular homeostasis, usually, but not necessarily, exogenous (e.g. temperature, humidity, ionizing radiation)."" [GOC:mah]",3855,60,29,21031,0.48333333333333334,0.007522697795071336,Module 1,['GO:0050896']
1037,GO:BP,GO:0045582,positive regulation of T cell differentiation,0.00023728600552388866,True,"""Any process that activates or increases the frequency, rate or extent of T cell differentiation."" [GOC:go_curators]",117,23,5,21031,0.21739130434782608,0.042735042735042736,Module 4,"['GO:0030217', 'GO:0045580', 'GO:0045621', 'GO:0050870']"
1038,HPA,HPA:0470671,skin 2; melanocytes[≥Low],0.0002383315865158811,True,skin 2; melanocytes[≥Low],724,47,14,11019,0.2978723404255319,0.019337016574585635,Module 1,['HPA:0470000']
1039,GO:BP,GO:0048585,negative regulation of response to stimulus,0.00024373518230155753,True,"""Any process that stops, prevents, or reduces the frequency, rate or extent of a response to a stimulus. Response to stimulus is a change in state or activity of a cell or an organism (in terms of movement, secretion, enzyme production, gene expression, etc.) as a result of a stimulus."" [GOC:jid]",1648,1478,171,21031,0.11569688768606225,0.10376213592233009,Module Singleton,"['GO:0048519', 'GO:0048583', 'GO:0050896']"
1040,GO:BP,GO:0018108,peptidyl-tyrosine phosphorylation,0.0002464787060484851,True,"""The phosphorylation of peptidyl-tyrosine to form peptidyl-O4'-phospho-L-tyrosine."" [RESID:AA0039]",258,1478,43,21031,0.029093369418132613,0.16666666666666666,Module Singleton,"['GO:0006468', 'GO:0018212']"
1041,GO:BP,GO:0002715,regulation of natural killer cell mediated immunity,0.00024671715549522393,True,"""Any process that modulates the frequency, rate, or extent of natural killer cell mediated immunity."" [GOC:add]",49,52,5,21031,0.09615384615384616,0.10204081632653061,Module 2,"['GO:0002228', 'GO:0002706', 'GO:0045088']"
1042,GO:BP,GO:0044419,biological process involved in interspecies interaction between organisms,0.00024882890245127314,True,"""Any process evolved to enable an interaction with an organism of a different species."" [GOC:cc]",1724,59,19,21031,0.3220338983050847,0.011020881670533642,Module 0,['GO:0008150']
1043,GO:BP,GO:0019538,protein metabolic process,0.0002504009608961492,True,"""The chemical reactions and pathways involving a protein. Includes protein modification."" [GOC:ma]",4912,60,33,21031,0.55,0.006718241042345277,Module 1,"['GO:0043170', 'GO:0044238', 'GO:1901564']"
1044,GO:BP,GO:0002703,regulation of leukocyte mediated immunity,0.0002544795398688649,True,"""Any process that modulates the frequency, rate, or extent of leukocyte mediated immunity."" [GOC:add]",243,52,8,21031,0.15384615384615385,0.03292181069958848,Module 2,"['GO:0002443', 'GO:0002697']"
1045,GO:BP,GO:0032735,positive regulation of interleukin-12 production,0.0002587248594998306,True,"""Any process that activates or increases the frequency, rate, or extent of interleukin-12 production."" [GOC:mah]",43,1478,15,21031,0.010148849797023005,0.3488372093023256,Module Singleton,"['GO:0001819', 'GO:0032615', 'GO:0032655']"
1046,HPA,HPA:0471392,skin 2; cells in basal layer[≥Medium],0.00026263660134049206,True,skin 2; cells in basal layer[≥Medium],754,52,15,11019,0.28846153846153844,0.01989389920424403,Module 0,['HPA:0471391']
1047,GO:BP,GO:0050864,regulation of B cell activation,0.00026831669491754755,True,"""Any process that modulates the frequency, rate or extent of B cell activation."" [GOC:ai]",132,1478,28,21031,0.018944519621109608,0.21212121212121213,Module Singleton,"['GO:0042113', 'GO:0051249']"
1048,REAC,REAC:R-HSA-372790,Signaling by GPCR,0.00027075205161826714,True,Signaling by GPCR,696,982,102,10842,0.10386965376782077,0.14655172413793102,Module Singleton,['REAC:R-HSA-162582']
1049,GO:BP,GO:0022408,negative regulation of cell-cell adhesion,0.00027377953871623035,True,"""Any process that stops, prevents or reduces the rate or extent of cell adhesion to another cell."" [GOC:isa_complete]",189,1478,35,21031,0.02368064952638701,0.18518518518518517,Module Singleton,"['GO:0007162', 'GO:0022407', 'GO:0098609']"
1050,GO:BP,GO:0051129,negative regulation of cellular component organization,0.0002781656738786139,True,"""Any process that stops, prevents, or reduces the frequency, rate or extent of a process involved in the formation, arrangement of constituent parts, or disassembly of cell structures, including the plasma membrane and any external encapsulating structures such as the cell wall and cell envelope."" [GOC:ai]",719,1478,89,21031,0.060216508795669824,0.12378303198887343,Module Singleton,"['GO:0016043', 'GO:0048523', 'GO:0051128']"
1051,GO:BP,GO:0009892,negative regulation of metabolic process,0.00028562763997449906,True,"""Any process that stops, prevents, or reduces the frequency, rate or extent of the chemical reactions and pathways within a cell or an organism."" [GOC:go_curators]",3455,37,20,21031,0.5405405405405406,0.005788712011577424,Module 3,"['GO:0008152', 'GO:0019222', 'GO:0048519']"
1052,GO:BP,GO:0051301,cell division,0.00029289949085282296,True,"""The process resulting in division and partitioning of components of a cell to form more cells; may or may not be accompanied by the physical separation of a cell into distinct, individually membrane-bounded daughter cells."" [GOC:di, GOC:go_curators, GOC:pr]",656,1478,83,21031,0.05615696887686062,0.12652439024390244,Module Singleton,['GO:0009987']
1053,GO:BP,GO:0010557,positive regulation of macromolecule biosynthetic process,0.0002957687805715013,True,"""Any process that increases the rate, frequency or extent of the chemical reactions and pathways resulting in the formation of a macromolecule, any molecule of high relative molecular mass, the structure of which essentially comprises the multiple repetition of units derived, actually or conceptually, from molecules of low relative molecular mass."" [GOC:dph, GOC:tb]",2603,1478,249,21031,0.16847090663058187,0.09565885516711486,Module Singleton,"['GO:0009059', 'GO:0010556', 'GO:0010604', 'GO:0031328']"
