,source,native,name,p_value,significant,description,term_size,query_size,intersection_size,effective_domain_size,precision,recall,query,parents
435,HPA,HPA:0461442,skin 1; fibrohistiocytic cells[≥Medium],3.865927278840768e-08,True,skin 1; fibrohistiocytic cells[≥Medium],699,47,18,11019,0.3829787234042553,0.02575107296137339,Module 1,['HPA:0461441']
436,GO:BP,GO:0006950,response to stress,3.870562044281142e-08,True,"""Any process that results in a change in state or activity of a cell or an organism (in terms of movement, secretion, enzyme production, gene expression, etc.) as a result of a disturbance in organismal or cellular homeostasis, usually, but not necessarily, exogenous (e.g. temperature, humidity, ionizing radiation)."" [GOC:mah]",3855,59,34,21031,0.576271186440678,0.008819714656290532,Module 0,['GO:0050896']
437,GO:BP,GO:0045859,regulation of protein kinase activity,3.906113813201697e-08,True,"""Any process that modulates the frequency, rate or extent of protein kinase activity."" [GOC:go_curators]",451,1478,73,21031,0.04939106901217862,0.16186252771618626,Module Singleton,"['GO:0001932', 'GO:0043549']"
438,GO:BP,GO:0022409,positive regulation of cell-cell adhesion,3.912557638590917e-08,True,"""Any process that activates or increases the rate or extent of cell adhesion to another cell."" [GOC:isa_complete]",318,23,9,21031,0.391304347826087,0.02830188679245283,Module 4,"['GO:0022407', 'GO:0045785', 'GO:0098609']"
439,GO:BP,GO:0022409,positive regulation of cell-cell adhesion,3.954838426641887e-08,True,"""Any process that activates or increases the rate or extent of cell adhesion to another cell."" [GOC:isa_complete]",318,1478,58,21031,0.03924221921515562,0.18238993710691823,Module Singleton,"['GO:0022407', 'GO:0045785', 'GO:0098609']"
440,HPA,HPA:0471471,skin 2; lymphocytes[≥Low],4.064535061996083e-08,True,skin 2; lymphocytes[≥Low],802,52,20,11019,0.38461538461538464,0.02493765586034913,Module 0,['HPA:0470000']
441,GO:BP,GO:0000070,mitotic sister chromatid segregation,4.09138908513414e-08,True,"""The cell cycle process in which replicated homologous chromosomes are organized and then physically separated and apportioned to two sets during the mitotic cell cycle. Each replicated chromosome, composed of two sister chromatids, aligns at the cell equator, paired with its homologous partner. One homolog of each morphologic type goes into each of the resulting chromosome sets."" [GOC:ai, GOC:jl]",189,1478,42,21031,0.028416779431664412,0.2222222222222222,Module Singleton,"['GO:0000819', 'GO:0140014', 'GO:1903047']"
442,GO:CC,GO:0042175,nuclear outer membrane-endoplasmic reticulum membrane network,4.184089551768219e-08,True,"""The continuous network of membranes encompassing the nuclear outer membrane and the endoplasmic reticulum membrane."" [GOC:bf, GOC:jl, GOC:mah, GOC:mcc, GOC:pr, GOC:vw]",1217,65,20,22097,0.3076923076923077,0.016433853738701727,Module 1,"['GO:0012505', 'GO:0016020']"
443,HPA,HPA:0471441,skin 2; fibrohistiocytic cells[≥Low],4.299626345351029e-08,True,skin 2; fibrohistiocytic cells[≥Low],1021,47,21,11019,0.44680851063829785,0.02056807051909892,Module 1,['HPA:0470000']
444,GO:BP,GO:0032879,regulation of localization,4.6834621514368206e-08,True,"""Any process that modulates the frequency, rate or extent of any process in which a cell, a substance, or a cellular entity is transported to, or maintained in, a specific location."" [GOC:mah]",2018,1478,219,21031,0.14817320703653586,0.10852329038652131,Module Singleton,"['GO:0050789', 'GO:0051179']"
445,GO:BP,GO:0002696,positive regulation of leukocyte activation,4.74063590284313e-08,True,"""Any process that activates or increases the frequency, rate, or extent of leukocyte activation."" [GOC:add]",354,1478,62,21031,0.04194857916102842,0.1751412429378531,Module Singleton,"['GO:0002684', 'GO:0002694', 'GO:0045321', 'GO:0050867']"
446,GO:BP,GO:0045807,positive regulation of endocytosis,4.7433236933524694e-08,True,"""Any process that activates or increases the frequency, rate or extent of endocytosis."" [GOC:go_curators]",153,1478,37,21031,0.02503382949932341,0.24183006535947713,Module Singleton,"['GO:0006897', 'GO:0030100', 'GO:0051050', 'GO:0051130']"
447,GO:BP,GO:0034341,response to type II interferon,4.848176807826609e-08,True,"""Any process that results in a change in state or activity of a cell or an organism (in terms of movement, secretion, enzyme production, gene expression, etc.) as a result of an interferon-gamma stimulus. Interferon-gamma is also known as type II interferon."" [GOC:add, ISBN:0126896631, PMID:15546383]",146,1478,36,21031,0.02435723951285521,0.2465753424657534,Module Singleton,"['GO:0034097', 'GO:0045087']"
448,GO:MF,GO:0019865,immunoglobulin binding,5.017145474905909e-08,True,"""Binding to an immunoglobulin."" [GOC:ma]",24,1449,14,20212,0.00966183574879227,0.5833333333333334,Module Singleton,['GO:0044877']
449,GO:BP,GO:0032611,interleukin-1 beta production,5.037017933471161e-08,True,"""The appearance of interleukin-1 beta due to biosynthesis or secretion following a cellular stimulus, resulting in an increase in its intracellular or extracellular levels."" [GOC:mah]",93,1478,28,21031,0.018944519621109608,0.3010752688172043,Module Singleton,['GO:0032612']
450,GO:BP,GO:0032651,regulation of interleukin-1 beta production,5.037017933471161e-08,True,"""Any process that modulates the frequency, rate, or extent of interleukin-1 beta production."" [GOC:mah]",93,1478,28,21031,0.018944519621109608,0.3010752688172043,Module Singleton,"['GO:0032611', 'GO:0032652']"
451,GO:CC,GO:0044194,cytolytic granule,5.156013873741919e-08,True,"""A specialized secretory lysosome that is present in cells with cytolytic capability such as cytotoxic T lymphocytes and natural killer cells. Cytolytic granules mediate the storage and regulated excretion of lytic molecules for killing of target cells."" [GOC:jl, PMID:11052265, PMID:12766758]",14,57,5,22097,0.08771929824561403,0.35714285714285715,Module 2,['GO:0005764']
452,GO:BP,GO:0051304,chromosome separation,5.199109552690945e-08,True,"""The cell cycle process in which paired chromosomes are detached from each other. Chromosome separation begins with the release of cohesin complexes from chromosomes; in budding yeast, this includes the cleavage of cohesin complexes along the chromosome arms, followed by the separation of the centromeric regions. Chromosome separation also includes formation of chromatid axes mediated by condensins, and ends with the disentangling of inter-sister catenation catalyzed by topoisomerase II (topo II)."" [GOC:ai, GOC:lb, GOC:mah, GOC:mtg_cell_cycle, PMID:20352243]",81,1478,26,21031,0.017591339648173207,0.32098765432098764,Module Singleton,"['GO:0007059', 'GO:0022402']"
453,GO:BP,GO:0033043,regulation of organelle organization,5.2409117193617475e-08,True,"""Any process that modulates the frequency, rate or extent of a process involved in the formation, arrangement of constituent parts, or disassembly of an organelle."" [GOC:mah]",1173,59,20,21031,0.3389830508474576,0.017050298380221655,Module 0,"['GO:0006996', 'GO:0051128']"
454,GO:MF,GO:0016684,"oxidoreductase activity, acting on peroxide as acceptor",5.362421785958394e-08,True,"""Catalysis of an oxidation-reduction (redox) reaction in which the peroxide group acts as a hydrogen or electron acceptor."" [GOC:ai]",56,1449,21,20212,0.014492753623188406,0.375,Module Singleton,['GO:0016491']
455,GO:BP,GO:0007015,actin filament organization,5.79631097720619e-08,True,"""A process that is carried out at the cellular level which results in the assembly, arrangement of constituent parts, or disassembly of cytoskeletal structures comprising actin filaments. Includes processes that control the spatial distribution of actin filaments, such as organizing filaments into meshworks, bundles, or other structures, as by cross-linking."" [GOC:mah]",463,59,14,21031,0.23728813559322035,0.03023758099352052,Module 0,"['GO:0030036', 'GO:0097435']"
456,GO:BP,GO:0002764,immune response-regulating signaling pathway,5.8648399249024545e-08,True,"""The cascade of processes by which a signal interacts with a receptor, causing a change in the level or activity of a second messenger or other downstream target, and ultimately leading to the activation, perpetuation, or inhibition of an immune response."" [GOC:add, ISBN:0781735149, PMID:15771571]",492,1478,77,21031,0.052097428958051424,0.1565040650406504,Module Singleton,"['GO:0007165', 'GO:0050776']"
457,GO:BP,GO:0048584,positive regulation of response to stimulus,6.052204154397981e-08,True,"""Any process that activates, maintains or increases the rate of a response to a stimulus. Response to stimulus is a change in state or activity of a cell or an organism (in terms of movement, secretion, enzyme production, gene expression, etc.) as a result of a stimulus."" [GOC:jid]",2274,23,16,21031,0.6956521739130435,0.007036059806508356,Module 4,"['GO:0048518', 'GO:0048583', 'GO:0050896']"
458,GO:BP,GO:0043549,regulation of kinase activity,6.07642594264309e-08,True,"""Any process that modulates the frequency, rate or extent of kinase activity, the catalysis of the transfer of a phosphate group, usually from ATP, to a substrate molecule."" [GOC:bf]",483,1478,76,21031,0.05142083897158322,0.15734989648033126,Module Singleton,"['GO:0042325', 'GO:0051338']"
459,GO:BP,GO:0002764,immune response-regulating signaling pathway,6.101536189469829e-08,True,"""The cascade of processes by which a signal interacts with a receptor, causing a change in the level or activity of a second messenger or other downstream target, and ultimately leading to the activation, perpetuation, or inhibition of an immune response."" [GOC:add, ISBN:0781735149, PMID:15771571]",492,23,10,21031,0.43478260869565216,0.02032520325203252,Module 4,"['GO:0007165', 'GO:0050776']"
460,GO:BP,GO:0009620,response to fungus,6.287779403557874e-08,True,"""Any process that results in a change in state or activity of a cell or an organism (in terms of movement, secretion, enzyme production, gene expression, etc.) as a result of a stimulus from a fungus."" [GOC:hb]",70,1478,24,21031,0.016238159675236806,0.34285714285714286,Module Singleton,['GO:0051707']
461,GO:BP,GO:0098869,cellular oxidant detoxification,6.697410483948691e-08,True,"""Any process carried out at the cellular level that reduces or removes the toxicity superoxide radicals or hydrogen peroxide."" [GOC:dos, GOC:vw]",94,1478,28,21031,0.018944519621109608,0.2978723404255319,Module Singleton,['GO:1990748']
462,GO:CC,GO:0098576,lumenal side of membrane,6.920991713042476e-08,True,"""Any side (leaflet) of a membrane that faces the lumen of an organelle."" [GOC:dos]",36,24,5,22097,0.20833333333333334,0.1388888888888889,Module 4,"['GO:0031090', 'GO:0098552']"
463,GO:BP,GO:0048583,regulation of response to stimulus,7.183225638092033e-08,True,"""Any process that modulates the frequency, rate or extent of a response to a stimulus. Response to stimulus is a change in state or activity of a cell or an organism (in terms of movement, secretion, enzyme production, gene expression, etc.) as a result of a stimulus."" [GOC:jid]",3939,59,34,21031,0.576271186440678,0.008631632394008631,Module 0,"['GO:0050789', 'GO:0050896']"
464,GO:BP,GO:0042325,regulation of phosphorylation,7.70604409968555e-08,True,"""Any process that modulates the frequency, rate or extent of addition of phosphate groups into a molecule."" [GOC:jl]",966,1478,124,21031,0.08389715832205684,0.12836438923395446,Module Singleton,"['GO:0016310', 'GO:0019220']"
465,REAC,REAC:R-HSA-8953897,Cellular responses to stimuli,7.709787567993228e-08,True,Cellular responses to stimuli,794,52,20,10842,0.38461538461538464,0.02518891687657431,Module 1,['REAC:0000000']
466,GO:BP,GO:0050866,negative regulation of cell activation,7.757412618400217e-08,True,"""Any process that stops, prevents, or reduces the frequency, rate or extent of cell activation."" [GOC:ai]",208,1478,44,21031,0.029769959404600813,0.21153846153846154,Module Singleton,"['GO:0001775', 'GO:0048523', 'GO:0050865', 'GO:0051241']"
467,HPA,HPA:0471442,skin 2; fibrohistiocytic cells[≥Medium],7.985415688905354e-08,True,skin 2; fibrohistiocytic cells[≥Medium],833,47,19,11019,0.40425531914893614,0.022809123649459785,Module 1,['HPA:0471441']
468,GO:BP,GO:0022407,regulation of cell-cell adhesion,8.599429885670253e-08,True,"""Any process that modulates the frequency, rate or extent of attachment of a cell to another cell."" [GOC:isa_complete]",477,59,14,21031,0.23728813559322035,0.029350104821802937,Module 0,"['GO:0030155', 'GO:0098609']"
469,GO:BP,GO:0030029,actin filament-based process,8.794113703157513e-08,True,"""Any cellular process that depends upon or alters the actin cytoskeleton, that part of the cytoskeleton comprising actin filaments and their associated proteins."" [GOC:mah]",805,59,17,21031,0.288135593220339,0.02111801242236025,Module 0,['GO:0009987']
470,GO:BP,GO:0032722,positive regulation of chemokine production,8.869839901725203e-08,True,"""Any process that activates or increases the frequency, rate, or extent of chemokine production."" [GOC:mah]",71,1478,24,21031,0.016238159675236806,0.3380281690140845,Module Singleton,"['GO:0001819', 'GO:0032602', 'GO:0032642']"
471,KEGG,KEGG:05323,Rheumatoid arthritis,9.291693296553525e-08,True,Rheumatoid arthritis,88,746,28,8484,0.03753351206434316,0.3181818181818182,Module Singleton,['KEGG:00000']
472,GO:BP,GO:0070661,leukocyte proliferation,9.427267756836297e-08,True,"""The expansion of a leukocyte population by cell division."" [GOC:add]",351,23,9,21031,0.391304347826087,0.02564102564102564,Module 4,['GO:0008283']
473,HPA,HPA:0471443,skin 2; fibrohistiocytic cells[High],9.536219193222401e-08,True,skin 2; fibrohistiocytic cells[High],467,47,15,11019,0.3191489361702128,0.032119914346895075,Module 1,['HPA:0471442']
474,GO:CC,GO:0098802,plasma membrane signaling receptor complex,1.0096457183657354e-07,True,"""Any protein complex that is part of the plasma membrane and which functions as a signaling receptor."" [GOC:dos]",307,1541,54,22097,0.03504218040233614,0.1758957654723127,Module Singleton,"['GO:0043235', 'GO:0098797']"
475,REAC,REAC:R-HSA-1280218,Adaptive Immune System,1.0188928286033065e-07,True,Adaptive Immune System,809,18,12,10842,0.6666666666666666,0.014833127317676144,Module 4,['REAC:R-HSA-168256']
476,GO:BP,GO:0051094,positive regulation of developmental process,1.0597440298240256e-07,True,"""Any process that activates or increases the rate or extent of development, the biological process whose specific outcome is the progression of an organism over time from an initial condition (e.g. a zygote, or a young adult) to a later condition (e.g. a multicellular animal or an aged adult)."" [GOC:ai]",1328,1478,157,21031,0.10622462787550745,0.11822289156626506,Module Singleton,"['GO:0032502', 'GO:0048518', 'GO:0050793']"
477,HPA,HPA:0040082,bone marrow; hematopoietic cells[≥Medium],1.1120402653958222e-07,True,bone marrow; hematopoietic cells[≥Medium],4256,47,39,11019,0.8297872340425532,0.009163533834586466,Module 1,['HPA:0040081']
478,GO:BP,GO:0045595,regulation of cell differentiation,1.1529111794120509e-07,True,"""Any process that modulates the frequency, rate or extent of cell differentiation, the process in which relatively unspecialized cells acquire specialized structural and functional features."" [GOC:go_curators]",1576,1478,179,21031,0.12110960757780785,0.11357868020304568,Module Singleton,"['GO:0030154', 'GO:0050793', 'GO:0050794']"
479,KEGG,KEGG:05322,Systemic lupus erythematosus,1.2033103068007724e-07,True,Systemic lupus erythematosus,132,16,7,8484,0.4375,0.05303030303030303,Module 4,['KEGG:00000']
480,REAC,REAC:R-HSA-500792,GPCR ligand binding,1.2143267071060968e-07,True,GPCR ligand binding,460,982,84,10842,0.0855397148676171,0.1826086956521739,Module Singleton,['REAC:R-HSA-372790']
481,GO:BP,GO:0050896,response to stimulus,1.2352684773520937e-07,True,"""Any process that results in a change in state or activity of a cell or an organism (in terms of movement, secretion, enzyme production, gene expression, etc.) as a result of a stimulus. The process begins with detection of the stimulus and ends with a change in state or activity or the cell or organism."" [GOC:ai, GOC:bf]",8976,52,45,21031,0.8653846153846154,0.005013368983957219,Module 2,['GO:0008150']
482,GO:BP,GO:0001932,regulation of protein phosphorylation,1.2541642311439475e-07,True,"""Any process that modulates the frequency, rate or extent of addition of phosphate groups into an amino acid in a protein."" [GOC:hjd]",910,1478,118,21031,0.07983761840324763,0.12967032967032968,Module Singleton,"['GO:0006468', 'GO:0031399', 'GO:0042325']"
483,GO:BP,GO:0002253,activation of immune response,1.2881720172327238e-07,True,"""Any process that initiates an immune response."" [GO_REF:0000022, GOC:add, ISBN:0781735149]",531,23,10,21031,0.43478260869565216,0.018832391713747645,Module 4,"['GO:0002376', 'GO:0050778']"
484,GO:BP,GO:1903037,regulation of leukocyte cell-cell adhesion,1.334444823009333e-07,True,"""Any process that modulates the frequency, rate or extent of leukocyte cell-cell adhesion."" [GO_REF:0000058, GOC:BHF, GOC:rl, GOC:TermGenie, PMID:21106532]",365,23,9,21031,0.391304347826087,0.024657534246575342,Module 4,"['GO:0007159', 'GO:0022407']"
485,GO:BP,GO:0001775,cell activation,1.3450955357390712e-07,True,"""A multicellular organismal process by which exposure to an activating factor such as a cellular or soluble ligand results in a change in the morphology or behavior of a cell."" [GOC:mgi_curators]",1092,59,19,21031,0.3220338983050847,0.0173992673992674,Module 0,"['GO:0009987', 'GO:0032501']"
486,GO:CC,GO:0042582,azurophil granule,1.3832334194565506e-07,True,"""Primary lysosomal granule found in neutrophil granulocytes. Contains a wide range of hydrolytic enzymes and is released into the extracellular fluid."" [GOC:jl, PMID:17152095]",154,1541,35,22097,0.0227125243348475,0.22727272727272727,Module Singleton,"['GO:0005766', 'GO:0030141']"
487,GO:CC,GO:0005766,primary lysosome,1.3832334194565506e-07,True,"""A lysosome before it has fused with a vesicle or vacuole."" [GOC:jl, ISBN:0815316194]",154,1541,35,22097,0.0227125243348475,0.22727272727272727,Module Singleton,['GO:0005764']
488,GO:BP,GO:0002688,regulation of leukocyte chemotaxis,1.3933635450142464e-07,True,"""Any process that modulates the frequency, rate, or extent of leukocyte chemotaxis."" [GOC:add]",123,1478,32,21031,0.02165087956698241,0.2601626016260163,Module Singleton,"['GO:0002685', 'GO:0030595', 'GO:0050920']"
489,GO:BP,GO:0071675,regulation of mononuclear cell migration,1.3933635450142464e-07,True,"""Any process that modulates the rate, frequency or extent of mononuclear cell migration. Mononuclear cell migration is the movement of a mononuclear cell within or between different tissues and organs of the body."" [GOC:mah]",123,1478,32,21031,0.02165087956698241,0.2601626016260163,Module Singleton,"['GO:0002685', 'GO:0071674']"
490,GO:BP,GO:0006915,apoptotic process,1.39465144672854e-07,True,"""A programmed cell death process which begins when a cell receives an internal (e.g. DNA damage) or external signal (e.g. an extracellular death ligand), and proceeds through a series of biochemical events (signaling pathway phase) which trigger an execution phase. The execution phase is the last step of an apoptotic process, and is typically characterized by rounding-up of the cell, retraction of pseudopodes, reduction of cellular volume (pyknosis), chromatin condensation, nuclear fragmentation (karyorrhexis), plasma membrane blebbing and fragmentation of the cell into apoptotic bodies. When the execution phase is completed, the cell has died."" [GOC:cjm, GOC:dhl, GOC:ecd, GOC:go_curators, GOC:mtg_apoptosis, GOC:tb, ISBN:0198506732, PMID:18846107, PMID:21494263]",1913,1478,208,21031,0.14073071718538566,0.10872974385781495,Module Singleton,['GO:0012501']
491,GO:BP,GO:0007159,leukocyte cell-cell adhesion,1.4708129791085334e-07,True,"""The attachment of a leukocyte to another cell via adhesion molecules."" [GOC:go_curators]",403,59,13,21031,0.22033898305084745,0.03225806451612903,Module 0,['GO:0098609']
492,GO:BP,GO:0071356,cellular response to tumor necrosis factor,1.5282231602848304e-07,True,"""Any process that results in a change in state or activity of a cell (in terms of movement, secretion, enzyme production, gene expression, etc.) as a result of a tumor necrosis factor stimulus."" [GOC:mah]",228,1478,46,21031,0.03112313937753721,0.20175438596491227,Module Singleton,"['GO:0034612', 'GO:0071345']"
493,GO:BP,GO:0050764,regulation of phagocytosis,1.5335661030584113e-07,True,"""Any process that modulates the frequency, rate or extent of phagocytosis, the process in which phagocytes engulf external particulate material."" [GOC:ai]",97,1478,28,21031,0.018944519621109608,0.28865979381443296,Module Singleton,"['GO:0006909', 'GO:0030100']"
494,KEGG,KEGG:04062,Chemokine signaling pathway,1.6468781683926012e-07,True,Chemokine signaling pathway,190,746,44,8484,0.058981233243967826,0.23157894736842105,Module Singleton,['KEGG:00000']
495,GO:BP,GO:0030101,natural killer cell activation,1.6545301433314075e-07,True,"""The change in morphology and behavior of a natural killer cell in response to a cytokine, chemokine, cellular ligand, or soluble factor."" [GOC:mgi_curators, ISBN:0781735149]",96,52,8,21031,0.15384615384615385,0.08333333333333333,Module 2,['GO:0046649']
496,GO:BP,GO:0050863,regulation of T cell activation,1.656460322355909e-07,True,"""Any process that modulates the frequency, rate or extent of T cell activation."" [GOC:ai]",374,23,9,21031,0.391304347826087,0.02406417112299465,Module 4,"['GO:0042110', 'GO:0051249']"
497,HPA,HPA:0030432,appendix; germinal center cells[≥Medium],1.6953285917034542e-07,True,appendix; germinal center cells[≥Medium],227,18,8,11019,0.4444444444444444,0.03524229074889868,Module 4,['HPA:0030431']
498,GO:BP,GO:0048523,negative regulation of cellular process,1.7614326449496682e-07,True,"""Any process that stops, prevents, or reduces the frequency, rate or extent of a cellular process, any of those that are carried out at the cellular level, but are not necessarily restricted to a single cell. For example, cell communication occurs among more than one cell, but occurs at the cellular level."" [GOC:jid]",5541,1478,497,21031,0.33626522327469555,0.0896950009023642,Module Singleton,"['GO:0009987', 'GO:0048519', 'GO:0050794']"
499,REAC,REAC:R-HSA-2132295,MHC class II antigen presentation,1.7709864805718657e-07,True,MHC class II antigen presentation,123,18,7,10842,0.3888888888888889,0.056910569105691054,Module 4,['REAC:R-HSA-1280218']
500,GO:CC,GO:0005770,late endosome,1.7790060260464673e-07,True,"""A prelysosomal endocytic organelle differentiated from early endosomes by lower lumenal pH and different protein composition. Late endosomes are more spherical than early endosomes and are mostly juxtanuclear, being concentrated near the microtubule organizing center."" [NIF_Subcellular:nlx_subcell_20090702, PMID:11964142, PMID:2557062]",314,24,8,22097,0.3333333333333333,0.025477707006369428,Module 4,['GO:0005768']
501,GO:BP,GO:0050863,regulation of T cell activation,1.785366245219787e-07,True,"""Any process that modulates the frequency, rate or extent of T cell activation."" [GOC:ai]",374,1478,63,21031,0.04262516914749662,0.16844919786096257,Module Singleton,"['GO:0042110', 'GO:0051249']"
502,GO:BP,GO:0000280,nuclear division,1.7924494599475504e-07,True,"""The division of a cell nucleus into two nuclei, with DNA and other nuclear contents distributed between the daughter nuclei."" [GOC:mah]",447,1478,71,21031,0.04803788903924222,0.15883668903803133,Module Singleton,['GO:0048285']
503,HPA,HPA:0471441,skin 2; fibrohistiocytic cells[≥Low],1.8377764317830387e-07,True,skin 2; fibrohistiocytic cells[≥Low],1021,922,141,11019,0.15292841648590022,0.13809990205680706,Module Singleton,['HPA:0470000']
504,GO:BP,GO:0043067,regulation of programmed cell death,1.8695783124775763e-07,True,"""Any process that modulates the frequency, rate or extent of programmed cell death, cell death resulting from activation of endogenous cellular processes."" [GOC:jl]",1506,1478,172,21031,0.11637347767253045,0.11420982735723771,Module Singleton,"['GO:0012501', 'GO:0050794']"
505,GO:BP,GO:0000819,sister chromatid segregation,2.0816950501363717e-07,True,"""The cell cycle process in which sister chromatids are organized and then physically separated and apportioned to two or more sets."" [GOC:ai, GOC:elh]",230,1478,46,21031,0.03112313937753721,0.2,Module Singleton,"['GO:0051276', 'GO:0098813']"
506,GO:BP,GO:0002718,regulation of cytokine production involved in immune response,2.11596122145944e-07,True,"""Any process that modulates the frequency, rate, or extent of cytokine production that contributes to an immune response."" [GOC:add]",118,1478,31,21031,0.02097428958051421,0.2627118644067797,Module Singleton,"['GO:0001817', 'GO:0002367', 'GO:0002700']"
507,GO:BP,GO:0002367,cytokine production involved in immune response,2.11596122145944e-07,True,"""The appearance of a cytokine due to biosynthesis or secretion following a cellular stimulus contributing to an immune response, resulting in an increase in its intracellular or extracellular levels."" [GO_REF:0000022, GOC:add, ISBN:0781735149]",118,1478,31,21031,0.02097428958051421,0.2627118644067797,Module Singleton,"['GO:0001816', 'GO:0002440', 'GO:0006955']"
508,GO:CC,GO:0071755,IgM B cell receptor complex,2.1815796515135324e-07,True,"""An IgM immunoglobulin complex that is present in the plasma membrane of B cells and is composed of two identical immunoglobulin heavy chains of the IgM isotype and two identical immunoglobulin light chains and a signaling subunit, a heterodimer of the Ig-alpha and Ig-beta proteins."" [GOC:add, ISBN:0781765196, PMID:20176268]",3,24,3,22097,0.125,1.0,Module 4,"['GO:0019815', 'GO:0071753']"
